### ISSUE TITLE
cpu  usage 100% and hang

### ISSUE THREAD

**Issue by yorks** [heiher/hev-socks5-tunnel#262]
只要我把默认路由改为hev-tun出去，不久就会出现卡死，日志也不打，不知的怎么调试，卡在哪里，我只能 restart 来临时解决。

下面是操作：
```bash
[yorks@yypc ~]$ sudo journalctl -f &
[2] 3670039

[yorks@yypc ~]$ ip r get 10.6.0.1
10.6.0.1 dev tun2sock src 198.18.0.1 uid 1000 
    cache 
[yorks@yypc ~]$ sudo tcpdump -i any host 10.6.0.1 &
[1] 3669492
top :
    PID USER      PR  NI    VIRT    RES    SHR S  %CPU  %MEM     TIME+ COMMAND                     
 255520 root      20   0  346996  38348    372 R  95.2   0.2  31:33.96 hev-socks5-tunn    

[yorks@yypc ~]$ curl 10.6.0.1 
10:32:42.825877 tun2sock Out IP yypc.36746 > 10.6.0.1.http: Flags [S], seq 2387837171, win 64240, options [mss 1460,sackOK,TS val 198657046 ecr 0,nop,wscale 7], length 0
10:32:43.848886 tun2sock Out IP yypc.36746 > 10.6.0.1.http: Flags [S], seq 2387837171, win 64240, options [mss 1460,sackOK,TS val 198658069 ecr 0,nop,wscale 7], length 0
10:32:46.008880 tun2sock Out IP yypc.36746 > 10.6.0.1.http: Flags [S], seq 2387837171, win 64240, options [mss 1460,sackOK,TS val 198660229 ecr 0,nop,wscale 7], length 0
^C
# 抓包发现有数据包到tun2sock，但是journalctl里面一点日志也没有。

```

版本：
```bash

[yorks@yypc ~]$ hev-socks5-tunnel --version
hev-socks5-tunnel CONFIG_PATH
Version: 2.13.0 f2cbad5


```

配置：
```yaml
tunnel:
  name: tun2sock
  mtu: 1500
  multi-queue: false
  ipv4: 198.18.0.1
  post-up-script: /user/local/bin/hev-socks5-tunnel.up.sh

socks5:
  port: 10808
  address: 127.0.0.1
  udp: 'udp'

misc:
  log-file: stderr
  log-level: info
  pid-file: /run/hev-socks5-tunnel.pid
```

**Comment by heiher** [comment]
流量环路了，即流量经socks5-tunnel到socks5 server，从socks5 server出来后又命中默认路由再次进入socks5-tunnel。你需要一个更高优先级的路由来让socks5-server出来的流量不走tun。

**Comment by yorks** [comment]
不大可能是环路，我socks5 server的是xray，其中的outbonds只有 vless(vps)跟 freedom（写了sendThrough 是出口的ip地址）。
而且还写了 routing-rules ip是vps的走feedom.其他走vless.

另外，系统的路由也陪了vps的ip走 出口的ip 不走tun2sock。

在另外，是使用了半天就会出现卡死，如果有环的话 应该很多网站都打不开？

**Comment by heiher** [comment]
我感觉还是xray的上行出口ip bypass的不全，偶然触发了环路。不妨试试把xray跑在另外一个主机或network namespace，然后把xray的ip显式做策略路由绕过tun，再看看还能不能复现。

**Comment by yorks** [comment]
好，我把xray搞走，试试。

**Comment by heiher** [comment]
怎么样？

**Comment by yorks** [comment]
> 怎么样？

抱歉，周末休息了两天，现在搞走，看看中午还会不会复现。

**Comment by yorks** [comment]
挪走后，的确一个上午没出现了，话说这种好像没办法从tcpdump中获取到具体的环路？

**Comment by heiher** [comment]
> 挪走后，的确一个上午没出现了，话说这种好像没办法从tcpdump中获取到具体的环路？

如果socks5的upstream地址是动态的，那基于地址匹配就比较麻烦了。看看能不能在socks5上给outgoing的流量打上fwmark，然后在ip rule上匹配。
