### ISSUE TITLE
UDP-over-TCP session destructs immediately after handshake on macOS (TCP works fine)

### ISSUE THREAD

**Issue by 1d10t** [heiher/hev-socks5-tunnel#298]
## Environment

- **Client:** hev-socks5-tunnel `2.14.4 4d6c334` (official release binary)
- **OS:** macOS (Mac mini, Apple Silicon)
- **Server:** hev-socks5-server (latest release), IPv6-only
- **Server address:** Yggdrasil mesh IPv6 (`200::/7`)
- **Reference working client:** sockstun on Android with the same server and `udp: 'tcp'` — UDP works perfectly.

## Problem

UDP traffic does not pass through the tunnel on macOS. TCP works flawlessly through the same tunnel/server. The UoT session is established successfully (full SOCKS5 handshake completes, server returns OK response), but the session is destructed immediately after handshake without forwarding any UDP data.

## Minimal reproducer

`/tmp/test.yaml`:
```yaml
tunnel:
  name: utun9
  mtu: 1500
  ipv4: 198.19.0.1
  ipv6: 'fc00::2'
socks5:
  port: 1080
  address: <ipv6-server-address>
  udp: 'tcp'
  username: '...'
  password: '...'
misc:
  log-level: debug
  log-file: stderr
```

```bash
sudo hev-socks5-tunnel /tmp/test.yaml
# in another terminal:
sudo route add -net 8.8.8.8/32 -interface utun9
dig @8.8.8.8 example.com
```

## Observed behavior

`dig` times out. `tcpdump -i utun9 -n udp` shows UDP packets reaching the tunnel interface:
```
19:10:07.546797 IP 198.19.0.1.53291 > 8.8.8.8.53: 43612+ [1au] A? example.com. (40)
19:10:12.548654 IP 198.19.0.1.53291 > 8.8.8.8.53: 43612+ [1au] A? example.com. (40)
19:10:17.558754 IP 198.19.0.1.53291 > 8.8.8.8.53: 43612+ [1au] A? example.com. (40)
```

Debug log shows the UoT session is created, full SOCKS5 handshake completes successfully, then the session is destructed:
```
[D] 0x100e33030 socks5 construct
[D] 0x100e33030 socks5 client construct
[I] 0x100e33030 socks5 client udp construct
[D] 0x100e33030 socks5 session udp construct
[D] 0x100e33030 socks5 session udp new
[D] 0x100e33030 socks5 session run
[D] 0x100e33030 socks5 client connect [<server>]:1080
[D] 0x100e33030 socks5 session udp bind
[D] 0x100e33030 socks5 client connect server fd 9
[D] 0x100e33030 socks5 client set auth
[D] 0x100e33030 socks5 client auth <user>:<pass>
[D] 0x100e33030 socks5 client handshake standard
[D] 0x100e33030 socks5 client write auth methods
[D] 0x100e33030 socks5 client read auth method
[D] 0x100e33030 socks5 client write auth creds
[D] 0x100e33030 socks5 client read auth creds
[D] 0x100e33030 socks5 client auth done
[D] 0x100e33030 socks5 client write request
[D] 0x100e33030 socks5 client read response
[I] 0x100e33030 socks5 client read response
[I] 0x100e33030 socks5 session handshake
[D] 0x100e33030 socks5 session udp destruct      ← immediately after handshake
[D] 0x100e33030 socks5 client udp destruct
[D] 0x100e33030 socks5 client destruct
[D] 0x100e33030 socks5 destruct
```

This pattern repeats for every retry from `dig`. TCP sessions to the same server through the same tunnel work perfectly (`socks5 session tcp splice` keeps the session alive).

## Cross-platform check

The exact same server with the same `udp: 'tcp'` mode works perfectly on **Android via sockstun**. Both clients use hev-socks5-tunnel core, but Android works and macOS does not.

## Additional context

- `hev-socks5-tunnel --version` → `2.14.4 4d6c334`
- TCP through the same tunnel: works (verified with `curl ifconfig.me` returning the proxy IP).
- `dig +tcp @8.8.8.8 example.com` through the tunnel: works.
- Tested with MTU 1500 and MTU 8500 — same behavior.
- Tested with `pipeline: true` — same behavior.
- Server reachable, server side IPv6, server runs latest hev-socks5-server.

Happy to provide pcap, full debug logs, or run additional diagnostics.

**Comment by 1d10t** [comment]
## Update with refined diagnosis

After more testing I can split the original report into **two distinct problems**, only one of which is a real bug.

### Problem A — port mismatch (my fault, not a hev bug)

The original reproducer above used `socks5.port: 1080` because that's the conventional SOCKS5 port. On my setup the actual `hev-socks5-server` was listening on **`main.port: 1081`** (the project's default), and there was an **unrelated `danted` (Dante)** instance on 1080 of the same host, left over from earlier experiments.

So `hev-socks5-tunnel` was talking to Dante, not to hev-socks5-server. Dante implements RFC1928 well enough for `CONNECT` (TCP) to look healthy, which is why TCP through the tunnel worked perfectly. Dante does **not** speak hev's UDP-over-TCP framing, so every UoT session ended in `socks5 session handshake` followed immediately by `socks5 session udp destruct` — the symptom reported above.

Fixing the port to `1081` immediately makes UoT work end-to-end:

```diff
 socks5:
-  port: 1080
+  port: 1081
   udp: 'tcp'
```

After that change MyWhoosh's real-time gameplay, QUIC in Chrome, DNS-over-UDP via MapDNS, etc. all start working from macOS.

### Problem B — `udp: 'udp'` (standard SOCKS5 UDP-ASSOCIATE) still fails on macOS

After fixing Problem A I retested all four combinations of `socks5.port` × `socks5.udp` and also fully **stopped Dante** on the server so that nothing else is touching either port. The result:

| port | udp mode | server actually reached | TCP | UDP / game |
|------|----------|-------------------------|-----|------------|
| 1080 | `tcp` | Dante (running)          | ✓ | ✗ |
| 1080 | `udp` | Dante (running)          | ✓ | ✗ |
| 1081 | `tcp` | hev-socks5-server        | ✓ | **✓** |
| 1081 | `udp` | hev-socks5-server        | ✓ | **✗** |
| 1081 | `udp` | hev-socks5-server (Dante stopped, port 1080 closed) | ✓ | **✗** |

The last row is the cleanest: only `hev-socks5-server` is running on the server, on the correct port, no other SOCKS daemon anywhere, and `udp: 'udp'` still does not forward UDP through the tunnel on macOS.

Same client binary, same Yggdrasil mesh, same `hev-socks5-server` instance, same auth. With `udp: 'tcp'` everything works. With `udp: 'udp'` the log shows the same dead-end pattern (just slightly different — there's a `client udp connect` step before destruct now):

```
[I] socks5 client udp construct
[D] socks5 session udp construct
[D] socks5 session udp new
[D] socks5 session udp bind
[D] socks5 session udp bind         ← double bind, no error logged
[I] socks5 client udp connect       ← connect() to BND.ADDR returned by server
[D] socks5 session udp destruct     ← immediately destructs, no splice ever
[D] socks5 client udp destruct
```

A few details that might help narrow it down:

- The `socks5 session udp bind` line appears **twice** per session in the macOS log. I don't know whether that's a normal "bind on tun side, then bind on outbound socket" pattern or whether the second bind is silently failing. There is no error message between the second bind, the `udp connect`, and the `destruct`.
- Across 133 sessions in a 1-minute `udp: 'udp'` test there were **0** `socks5 session udp splice` events. In `udp: 'tcp'` mode under the same load there are dozens.
- For comparison: **`sockstun` on Android with the exact same `hev-socks5-server`, same Yggdrasil address, same credentials, in `udp: 'udp'` mode works** — UDP is forwarded normally and games work. So either macOS sends a malformed UDP packet here, the BND.ADDR returned by the server is parsed differently between platforms, or the second `bind` step fails silently without producing a log line.

### Minimal reproducer (no split-default, no other tools)

To rule out interaction with the rest of my setup I reproduced Problem B with the absolute smallest configuration possible on macOS:

```bash
# 1. Stop everything else (no tunnel-manager, no split-default routes,
#    no DNS rewrite, no Dante on the server, nothing).
# 2. Edit /etc/hev-socks5-tunnel/config.yaml so it has only:
#       socks5.address = <yggdrasil mesh ipv6 of hev-socks5-server>
#       socks5.port    = 1081      (the hev-socks5-server default)
#       socks5.udp     = 'udp'
#       (nothing else relevant)
# 3. Start hev directly:
sudo /usr/local/bin/hev-socks5-tunnel /etc/hev-socks5-tunnel/config.yaml &
# 4. Add ONE host route into its tun, leave the kernel default alone:
sudo route add 8.8.8.8/32 -interface utun5
# 5. Try a UDP DNS query through the tun:
dig +time=3 +tries=1 @8.8.8.8 example.com
```

Result:

- `dig` times out.
- The hev debug log shows the same `construct → bind → bind → udp connect → destruct` pattern as in the original report. Zero `udp splice` events.
- `tcpdump -i utun5 -n udp` shows the DNS query reaching the tun.
- Nothing in the routing table can possibly create a feedback loop — `0.0.0.0/0` still points at the physical gateway, only `8.8.8.8/32` points at `utun5`.

So the failure is not caused by anything in `tunnel-manager.sh`, not by split-default routing, not by a stale Dante on the server, not by exclusion routes, and not by DNS rewrite. It is entirely inside `hev-socks5-tunnel` itself in `udp: 'udp'` mode on macOS.

Switching `socks5.udp` to `'tcp'` (UoT) in the same minimal setup makes everything work.

Happy to provide a `pcap` of the macOS path on the tunnel interface or strace-equivalent if you tell me what would help narrow it down.

### Workaround / known-good config

For anyone landing here: `udp: 'tcp'` (UoT) is the working mode on macOS. Full working setup over an Yggdrasil-only IPv6 mesh with split-default routing, MapDNS / fake-IP, system DNS rewrite, and launchd autostart is here:

https://gist.github.com/1d10t/3ee48da74224ed0e0d19b394980f52ed

**Comment by 1d10t** [comment]
## Cross-references and a Yggdrasil-rules-out data point

After scanning the open issue tracker, two more issues are tangentially related to Problem B in this report:

- **#175 — "Reuse of udp relay"**
  Architectural background: in the current design `hev-socks5-tunnel` opens a fresh SOCKS5 UDP-ASSOCIATE relay for *every* (destination addr, source port) pair instead of multiplexing one relay across many destinations. This is what produces the long stream of `socks5 client udp construct` / `bind` / `destruct` events I see in the log — every retry from `dig` is a brand-new SOCKS5 handshake. Whatever subtle wire/state bug exists in `udp: 'udp'` is therefore amplified into "100% of UDP requests fail" rather than "first request fails, retries succeed". Closing #175 was reasonable, but if Problem B turns out to be in the per-session bring-up path, fixing #175 would also drastically reduce the blast radius.

- **#285 — "Published ports are not working with certain applications"**
  In a comment on this issue @engageub reports an independent failure mode: *"Proxiware proxies do not work with UDP when the HevSocks tunnel is used. These proxies also do not function with tun2socks. However, the same proxies work correctly when using tun2proxy."*
  Different setup (Linux Docker + Proxiware) but the same shape: TCP via `hev-socks5-tunnel` works, UDP through the same proxy via the same tunnel does not, and a different tun-to-socks client (`tun2proxy`) passes UDP through the same proxy without trouble. Worth checking whether both reports trace to the same code path in the `udp: 'udp'` relay handler.

### Yggdrasil ruled out as the carrier

To eliminate the obvious "is the underlying transport just dropping UDP?" hypothesis I tested an entirely separate UDP setup over the same Yggdrasil link:

- **OpenVPN client** on the same macOS Mac mini, in UDP mode, connecting to **OpenVPN server** running on the same VPS that hosts the `hev-socks5-server`, listening on the same Yggdrasil address.
- The OpenVPN tunnel establishes and stays up; UDP encrypted payload flows in both directions reliably.

So the Yggdrasil mesh between this Mac and that VPS demonstrably forwards arbitrary UDP without issue. The failure of `hev-socks5-tunnel` `udp: 'udp'` on the same Mac talking to the same VPS over the same mesh therefore cannot be blamed on the carrier — it has to live somewhere in the SOCKS5 UDP-ASSOCIATE handling on either the client (`hev-socks5-tunnel` 2.14.4 macOS) or the server (`hev-socks5-server`, latest), or in their interaction.

**Comment by heiher** [comment]
Could you upload the config files for both hev-socks5-server and hev-socks5-tunnel?

**Comment by 1d10t** [comment]
server `/etc/hev-socks5-server/config.yml`
```
main:
  # Worker threads
  workers: 1
  
  # Listen TCP port
  port: PORT
  
  # Listen address (ipv4|ipv6)
  listen-address: 'YGGDRASIL_IPV6'
  
  # UDP listen port (0: random, a-b: range)
  udp-port: 0
  
  # UDP listen address
  udp-listen-address: 'YGGDRASIL_IPV6'
  
  # UDP public address (ipv6)
  udp-public-address-v6: 'YGGDRASIL_IPV6'
  
  # Listen ipv6 only
  listen-ipv6-only: true
  
  # Bind source network interface
  bind-interface: ''
  
  # Domain address type (ipv4|ipv6|unspec)
  domain-address-type: unspec

auth:
  file: /etc/hev-socks5-server/auth.txt

misc:
  # task stack size (bytes)
  task-stack-size: 8192
  
  # UDP socket recv buffer size (bytes)
  udp-recv-buffer-size: 524288
  
  # number of udp buffers in splice, 1500 bytes per buffer
  udp-copy-buffer-nums: 10
  
  # TCP connect timeout (ms)
  connect-timeout: 10000
  
  # TCP read-write timeout (ms)
  tcp-read-write-timeout: 300000
  
  # UDP read-write timeout (ms)
  udp-read-write-timeout: 60000
  
  # log file
  log-file: /var/log/hev-socks5-server.log
  
  # debug, info, warn or error
  log-level: error
  
  # pid file
  pid-file: /var/run/hev-socks5-server.pid
  
  # limit nofile
  limit-nofile: 65535
```


client `/etc/hev-socks5-tunnel/config.yaml`
```
tunnel:
  name: tun0
  mtu: 16384
  #mtu: 1400
  multi-queue: false
  ipv4: 198.18.0.1
  ipv6: 'fc00::1'

socks5:
  # Your IPv6 SOCKS5 proxy server
  port: PORT
  address: YGGDRASIL_IPV6
  #pipeline: true
  #udp: 'tcp'
  udp: 'udp'
  # If your proxy requires auth:
  username: 'USER'
  password: 'PASSWORD'

mapdns:
  address: 198.18.0.2
  port: 53
  network: 100.64.0.0
  netmask: 255.192.0.0
  cache-size: 10000

#misc:
#  log-level: info
#  log-file: stderr
misc:
  log-level: debug
  log-file: /tmp/hev.log
```

**Comment by heiher** [comment]
Fixed by https://github.com/heiher/hev-socks5-tunnel/commit/ad7843c1243f858262de65f23e770c80509a97b6 Thanks for the report!
