### ISSUE TITLE
client侧尽可能实现0rtt

### ISSUE THREAD

**Issue by ccaapton** [heiher/hev-socks5-tunnel#291]
目前标准socks5连接流程： tcp三次握手 -> socks5 握手 -> socks5 帐密传输 -> 内容传输，这个流程在内网环境中没有太大影响，但在长距离传输上影响很大。其他协议如vless + reality 会减少一些rtt，但应用范围太窄，不适合低内存/性能设备部署。

hev是否可以考虑在保持兼容性的前提下优化rtt呢，比如client采用tcp-fastopen, socks第一个包合并socks5 握手+帐密+内容首包，这样就能达到0rtt了。server端不需要任何改动。

这个方案我自己在v2ray v4的时候fork了实现过，延迟提升非常明显，但现在已经跟不上v2ray源码节奏，且v2ray在低端路由器上不能部署。

**Comment by heiher** [comment]
> tcp-fastopen

目前还没有，可以加个配置项

> socks第一个包合并socks5 握手+帐密+内容首包

这个已经有了，由于有些socks5服务端对tcp流读取实现不严谨会有兼容性问题，因此默认是关闭的，需要通过`socks5.pipeline = true`开启。

**Comment by heiher** [comment]
> > tcp-fastopen
> 
> 目前还没有，可以加个配置项

Fixed by https://github.com/heiher/hev-socks5-tunnel/commit/192d9e9c2173f0b3bb1132e10ebdfa23116aac97

**Comment by ccaapton** [comment]
> > socks第一个包合并socks5 握手+帐密+内容首包
> 
> 这个已经有了，由于有些socks5服务端对tcp流读取实现不严谨会有兼容性问题，因此默认是关闭的，需要通过`socks5.pipeline = true`开启。

@heiher 
我用tcpdump看了下包形状，貌似目前还是3个包(3+10+payload)，与标准socks5的区别只是第二个包没有等待服务器的握手回复。从时间上看，第二个包甚至是等到第一个包被ack了后才发的。
```
10:35:28.941012 IP 10.41.50.10.56956 > 192.168.5.4.41857: Flags [S], seq 134681714, win 65000, options [mss 1300,sackOK,TS val 397937472 ecr 0,nop,wscale 6], length 0
10:35:28.977929 IP 192.168.5.4.41857 > 10.41.50.10.56956: Flags [S.], seq 3756505530, ack 134681715, win 65160, options [mss 1300,sackOK,TS val 3415135678 ecr 397937472,nop,wscale 6], length 0
10:35:28.978047 IP 10.41.50.10.56956 > 192.168.5.4.41857: Flags [.], ack 1, win 1016, options [nop,nop,TS val 397937509 ecr 3415135678], length 0
10:35:28.978152 IP 10.41.50.10.56956 > 192.168.5.4.41857: Flags [P.], seq 1:4, ack 1, win 1016, options [nop,nop,TS val 397937510 ecr 3415135678], length 3
10:35:29.002889 IP 192.168.5.4.41857 > 10.41.50.10.56956: Flags [.], ack 4, win 1019, options [nop,nop,TS val 3415135703 ecr 397937510], length 0
10:35:29.002978 IP 10.41.50.10.56956 > 192.168.5.4.41857: Flags [P.], seq 4:14, ack 1, win 1016, options [nop,nop,TS val 397937534 ecr 3415135703], length 10
10:35:29.002998 IP 192.168.5.4.41857 > 10.41.50.10.56956: Flags [P.], seq 1:3, ack 4, win 1019, options [nop,nop,TS val 3415135703 ecr 397937510], length 2
10:35:29.003024 IP 10.41.50.10.56956 > 192.168.5.4.41857: Flags [.], ack 3, win 1016, options [nop,nop,TS val 397937534 ecr 3415135703], length 0
10:35:29.021913 IP 192.168.5.4.41857 > 10.41.50.10.56956: Flags [P.], seq 3:13, ack 14, win 1019, options [nop,nop,TS val 3415135726 ecr 397937534], length 10
10:35:29.021994 IP 10.41.50.10.56956 > 192.168.5.4.41857: Flags [.], ack 13, win 1016, options [nop,nop,TS val 397937553 ecr 3415135726], length 0
10:35:29.022234 IP 10.41.50.10.56956 > 192.168.5.4.41857: Flags [.], seq 14:1302, ack 13, win 1016, options [nop,nop,TS val 397937554 ecr 3415135726], length 1288
10:35:29.022246 IP 10.41.50.10.56956 > 192.168.5.4.41857: Flags [P.], seq 1302:1926, ack 13, win 1016, options [nop,nop,TS val 397937554 ecr 3415135726], length 624
10:35:29.051416 IP 192.168.5.4.41857 > 10.41.50.10.56956: Flags [.], ack 1926, win 990, options [nop,nop,TS val 3415135755 ecr 397937554], length 0
10:35:29.463657 IP 192.168.5.4.41857 > 10.41.50.10.56956: Flags [P.], seq 13:1395, ack 1926, win 990, options [nop,nop,TS val 3415136152 ecr 397937554], length 1382
```
从代码来看，目前pipeline和standard的区别只是调换了hev_socks5_client_read_auth_creds /hev_socks5_client_write_auth_methods 这几个函数的顺序，但底层的send还是一个个分开来的，而且[这样写](https://github.com/heiher/hev-socks5-core/blob/cbff465b916832455c1cb02f1f9e25a41062054d/src/hev-socks5-client.c#L26)的话，系统一定回等到内容被ack了才会返回，所以上面的包形状也就不难理解了。

我自己用python手搓了一个包合并的toy code, 是可以工作的(TFO请求被运营商抹掉了，所以没有成功):
```
def connect_socks5_tfo(proxy_host, proxy_port, target_bytes, first_payload: bytes):
    # 1. Create socket and enable TCP Fast Open
    s = socket.socket(socket.AF_INET, socket.SOCK_STREAM)
    greeting_payload = b'\x05\x01\x00'
    request = b'\x05\x01\x00'
    request += target_bytes
    request += first_payload
    # Enable TFO on the client socket (Requires OS support: Linux 3.6+, macOS, Windows 10+)
    # print("Warning: TCP Fast Open not supported or enabled on this OS. Falling back to regular connect.")
    s.setsockopt(socket.SOL_TCP, socket.TCP_FASTOPEN_CONNECT, 1)
    s.connect((proxy_host, proxy_port))
    # Send greeting normally if TFO is not supported
    s.sendall(greeting_payload + request)
```

对应的符合预期的抓包如下:
```
11:02:42.165543 IP 10.41.50.10.55552 > 192.168.5.4.41857: Flags [S], seq 3876054462, win 64240, options [mss 1300,sackOK,TS val 3876543847 ecr 0,nop,wscale 10], length 0
11:02:42.207667 IP 192.168.5.4.41857 > 10.41.50.10.55552: Flags [S.], seq 2054479588, ack 3876054463, win 65160, options [mss 1300,sackOK,TS val 4225551859 ecr 3876543847,nop,wscale 6], length 0
11:02:42.208014 IP 10.41.50.10.55552 > 192.168.5.4.41857: Flags [.], ack 1, win 63, options [nop,nop,TS val 3876543889 ecr 4225551859], length 0
11:02:42.208096 IP 10.41.50.10.55552 > 192.168.5.4.41857: Flags [.], seq 1:1289, ack 1, win 63, options [nop,nop,TS val 3876543889 ecr 4225551859], length 1288
11:02:42.208103 IP 10.41.50.10.55552 > 192.168.5.4.41857: Flags [P.], seq 1289:1585, ack 1, win 63, options [nop,nop,TS val 3876543889 ecr 4225551859], length 296
11:02:42.248834 IP 192.168.5.4.41857 > 10.41.50.10.55552: Flags [.], ack 1585, win 994, options [nop,nop,TS val 4225551895 ecr 3876543889], length 0
11:02:42.248849 IP 192.168.5.4.41857 > 10.41.50.10.55552: Flags [P.], seq 1:3, ack 1585, win 994, options [nop,nop,TS val 4225551895 ecr 3876543889], length 2
11:02:42.249006 IP 10.41.50.10.55552 > 192.168.5.4.41857: Flags [.], ack 3, win 63, options [nop,nop,TS val 3876543930 ecr 4225551895], length 0
11:02:42.283108 IP 192.168.5.4.41857 > 10.41.50.10.55552: Flags [P.], seq 3:13, ack 1585, win 994, options [nop,nop,TS val 4225551929 ecr 3876543930], length 10
11:02:42.283258 IP 10.41.50.10.55552 > 192.168.5.4.41857: Flags [.], ack 13, win 63, options [nop,nop,TS val 3876543964 ecr 4225551929], length 0
```

所以要实现3包合并，需要手工合并到一个数组里，然后一次性发送

**Comment by heiher** [comment]
> 底层的send还是一个个分开来的，而且[这样写](https://github.com/heiher/hev-socks5-core/blob/cbff465b916832455c1cb02f1f9e25a41062054d/src/hev-socks5-client.c#L26)的话，系统一定回等到内容被ack了才会返回

我理解不是要等到ack才能发送后续的数据的。多个连续send的数据可能会合并也可能分开，宏观上具有一定的随机性。

再测测高延迟的环境，看看前几段数据的发送时间受不受高延迟响应的影响？

**Comment by ccaapton** [comment]
> 宏观上具有一定的随机性。

可能吧，但是结合TCP_FASTOPEN就一定会有这个损失，因为TFO情况下，首包没有收到syn/ack是一定不会继续发包的。

> 再测测高延迟的环境，看看前几段数据的发送时间受不受高延迟响应的影响？

加了100ms延迟，还是这样
```
18:08:31.855320 IP 10.41.50.10.51426 > 192.168.5.4.41857: Flags [S], seq 3122823842, win 65000, options [mss 1300,sackOK,TS val 3890725978 ecr 0,nop,wscale 6,tfo  cookiereq,nop,nop], length 0
18:08:31.911386 IP 192.168.5.4.41857 > 10.41.50.10.51426: Flags [S.], seq 199449324, ack 3122823843, win 65160, options [mss 1300,sackOK,TS val 3740675121 ecr 3890725978,nop,wscale 6], length 0
18:08:31.911530 IP 10.41.50.10.51426 > 192.168.5.4.41857: Flags [.], ack 1, win 1016, options [nop,nop,TS val 3890726034 ecr 3740675121], length 0
18:08:31.911667 IP 10.41.50.10.51426 > 192.168.5.4.41857: Flags [P.], seq 1:4, ack 1, win 1016, options [nop,nop,TS val 3890726034 ecr 3740675121], length 3
18:08:31.959504 IP 192.168.5.4.41857 > 10.41.50.10.51426: Flags [.], ack 4, win 1019, options [nop,nop,TS val 3740675168 ecr 3890726034], length 0
18:08:31.959620 IP 10.41.50.10.51426 > 192.168.5.4.41857: Flags [P.], seq 4:14, ack 1, win 1016, options [nop,nop,TS val 3890726082 ecr 3740675168], length 10
18:08:31.959504 IP 192.168.5.4.41857 > 10.41.50.10.51426: Flags [P.], seq 1:3, ack 4, win 1019, options [nop,nop,TS val 3740675168 ecr 3890726034], length 2
18:08:31.959745 IP 10.41.50.10.51426 > 192.168.5.4.41857: Flags [.], ack 3, win 1016, options [nop,nop,TS val 3890726082 ecr 3740675168], length 0
18:08:32.010556 IP 192.168.5.4.41857 > 10.41.50.10.51426: Flags [P.], seq 3:13, ack 14, win 1019, options [nop,nop,TS val 3740675221 ecr 3890726034], length 10
18:08:32.010642 IP 10.41.50.10.51426 > 192.168.5.4.41857: Flags [.], ack 13, win 1016, options [nop,nop,TS val 3890726133 ecr 3740675221], length 0
18:08:32.010781 IP 10.41.50.10.51426 > 192.168.5.4.41857: Flags [.], seq 14:1302, ack 13, win 1016, options [nop,nop,TS val 3890726133 ecr 3740675221], length 1288
```

Edit: 怀疑是没有加tcp nodelay, 触发了Nagle. 第一个payload天然不会触发Nagle, 但后续的payload就会了。下面是Nagle描述:
> TCP的Nagle算法核心原则是“在网络上有未确认数据（小包）时，不能发送新的小包”。为了避免网络拥塞，系统会在发送端收集这些小数据块，等待上一个数据包的ACK确认后再一起发送。

所以上面帖子写的那个send，应该是没有阻塞，但是包被nagle给扣下了，直到看到ack才继续发

**Comment by heiher** [comment]
确实如此。先用`MSG_MORE`让SOCKS5认证和请求能够合并发送，Linux以外平台支持以及应用数据与SOCKS5握手合并看上去需要做更多的改动才行。
